<?xml version='1.0' encoding='UTF-8'?>
<SensorSpec xmlns="http://lignex1.com/mcmc2/umsSchema" xmlns:xsi="http://www.w3.org/2001/XMLSchema-instance" xsi:schemaLocation="http://lignex1.com/mcmc2/umsSchema ../../XSD/CommonSpecSchema.xsd">
  <!--항해레이더 정보처리장치 Semantic: 항해레이더 정보처리 CSC + 원격통제장치 CSCI + 공용 구조체/식별자 규칙 기반-->
  <!--RadarAISFusionContactReportType은 센서융합 정보처리 CSC 전용 송신이므로 원격 HMI Semantic 대상에서 제외한다.-->
  <!--물리 enum code와 DDS 자료형은 Binding 책임으로 두며 Semantic에는 운용 의미만 선언한다.-->
  <ConstantSpecs id="constant">
    <TextConstantSpec id="productName" name="제품명" cdm="Product.Name">
      <Value>NavigationRadarProcessor</Value>
    </TextConstantSpec>
    <TextConstantSpec id="productDescription" name="제품 설명" cdm="Product.Description">
      <Value>항해레이더/AIS 접촉물 처리, 상태 감시, 원격 제어 및 레이더 영상 제공 인터페이스</Value>
    </TextConstantSpec>
  </ConstantSpecs>
  <MonitorSpecs id="monitor">
    <GroupSpec id="radarContacts" name="항해레이더 접촉물 정보" cdm="Contact.Radar">
      <QuantitySpec id="contactNum" name="접촉물 개수" cdm="Contact.Radar.Count">
        <Unit>num</Unit>
      </QuantitySpec>
      <CollectionSpec id="contactTypeList" name="항해레이더 접촉물 목록" cdm="Contact.Radar.List" minOccurs="0" maxOccurs="256">
        <ElementSpec id="radarContact" name="항해레이더 접촉물" cdm="Contact.Radar.Item">
          <QuantitySpec id="contactID" name="접촉물 식별번호" cdm="Contact.Identifier">
            <Range min="10000"/>
          </QuantitySpec>
          <QuantitySpec id="detectionRange" name="거리" cdm="Contact.Range">
            <Unit>m</Unit>
            <Range min="0" max="12000"/>
          </QuantitySpec>
          <QuantitySpec id="azimuth" name="방위각" cdm="Contact.Azimuth">
            <Unit>deg</Unit>
            <Range min="0" max="360"/>
          </QuantitySpec>
          <QuantitySpec id="latitude" name="위도" cdm="Contact.Position.Latitude">
            <Unit>deg</Unit>
            <Range min="-90" max="90"/>
          </QuantitySpec>
          <QuantitySpec id="longitude" name="경도" cdm="Contact.Position.Longitude">
            <Unit>deg</Unit>
            <Range min="-180" max="180"/>
          </QuantitySpec>
          <QuantitySpec id="course" name="침로" cdm="Contact.Course">
            <Unit>deg</Unit>
            <Range min="0" max="360"/>
          </QuantitySpec>
          <QuantitySpec id="speed" name="속력" cdm="Contact.Speed">
            <Unit>kts</Unit>
            <Range min="0" max="45"/>
          </QuantitySpec>
          <QuantitySpec id="size" name="유효크기" cdm="Contact.Size">
            <Unit>m</Unit>
          </QuantitySpec>
          <QuantitySpec id="rcs" name="레이더 반사 단면적" cdm="Contact.RCS"/>
          <QuantitySpec id="cpa" name="CPA" cdm="Contact.CPA">
            <Unit>m</Unit>
          </QuantitySpec>
          <QuantitySpec id="tcpa" name="TCPA" cdm="Contact.TCPA">
            <Unit>s</Unit>
          </QuantitySpec>
          <QuantitySpec id="collisionRisk" name="충돌위험도" cdm="Contact.CollisionRisk">
            <Unit>%</Unit>
            <Range min="1" max="100"/>
          </QuantitySpec>
        </ElementSpec>
      </CollectionSpec>
    </GroupSpec>
    <GroupSpec id="aisContacts" name="AIS 접촉물 정보" cdm="Contact.AIS">
      <QuantitySpec id="contactNum" name="접촉물 개수" cdm="Contact.AIS.Count">
        <Unit>num</Unit>
      </QuantitySpec>
      <!--CSV 재심층 감사: AISContactType의 Range 열 일부는 행이 밀려 섞인 값으로 확인되었다. 동일 공용 구조체의 RadarAISFusionContactType에서 같은 필드명/자료형/단위가 다시 정의된 경우에만 교차확인 Range를 적용하고, 대응 근거가 없는 shipLength/shipWidth 등은 Range를 비워 둔다.-->
      <CollectionSpec id="contactTypeList" name="AIS 접촉물 목록" cdm="Contact.AIS.List" minOccurs="0" maxOccurs="256">
        <ElementSpec id="aisContact" name="AIS 접촉물" cdm="Contact.AIS.Item">
          <QuantitySpec id="contactID" name="접촉물 식별번호" cdm="Contact.Identifier">
            <Range min="20000"/>
          </QuantitySpec>
          <QuantitySpec id="mmsi" name="선박고유식별번호" cdm="Contact.AIS.MMSI"/>
          <QuantitySpec id="latitude" name="위도" cdm="Contact.Position.Latitude">
            <Unit>deg</Unit>
            <Range min="-90" max="90"/>
          </QuantitySpec>
          <QuantitySpec id="longitude" name="경도" cdm="Contact.Position.Longitude">
            <Unit>deg</Unit>
            <Range min="-180" max="180"/>
          </QuantitySpec>
          <QuantitySpec id="course" name="침로" cdm="Contact.Course">
            <Unit>deg</Unit>
            <Range min="0" max="360"/>
          </QuantitySpec>
          <QuantitySpec id="speed" name="속력" cdm="Contact.Speed">
            <Unit>kts</Unit>
            <Range min="0" max="45"/>
          </QuantitySpec>
          <QuantitySpec id="detectionRange" name="거리" cdm="Contact.Range">
            <Unit>m</Unit>
            <Range min="0" max="12000"/>
          </QuantitySpec>
          <QuantitySpec id="cpa" name="CPA" cdm="Contact.CPA">
            <Unit>m</Unit>
          </QuantitySpec>
          <QuantitySpec id="tcpa" name="TCPA" cdm="Contact.TCPA">
            <Unit>s</Unit>
          </QuantitySpec>
          <QuantitySpec id="collisionRisk" name="충돌위험도" cdm="Contact.CollisionRisk">
            <Unit>%</Unit>
            <Range min="1" max="100"/>
          </QuantitySpec>
          <QuantitySpec id="heading" name="선수방위각" cdm="Contact.Heading">
            <Unit>deg</Unit>
            <Range min="0" max="360"/>
            <Resolution>0.1</Resolution>
          </QuantitySpec>
          <QuantitySpec id="rateOfTurn" name="선박 회전속도" cdm="Contact.RateOfTurn">
            <Unit>deg/min</Unit>
            <Range min="-90" max="90"/>
          </QuantitySpec>
          <TextSpec id="shipName" name="선박명" cdm="Contact.AIS.ShipName">
            <MaxLength>21</MaxLength>
          </TextSpec>
          <QuantitySpec id="shipType" name="선박종류" cdm="Contact.AIS.ShipType">
            <Range min="0" max="255"/>
          </QuantitySpec>
          <QuantitySpec id="shipLength" name="선박길이" cdm="Contact.Length">
            <Unit>m</Unit>
          </QuantitySpec>
          <QuantitySpec id="shipWidth" name="선박너비" cdm="Contact.Width">
            <Unit>m</Unit>
          </QuantitySpec>
        </ElementSpec>
      </CollectionSpec>
    </GroupSpec>
        <GroupSpec id="radarStatus" name="항해레이더 상태" cdm="Radar.Status">
      <ValueSetSpec id="transmitStatus" name="레이더 송출 상태" cdm="Radar.Status.Transmit">
        <Values>
          <Value name="Standby" cdm="Radar.Transmit.Standby"/>
          <Value name="Transmit" cdm="Radar.Transmit.Transmit"/>
        </Values>
      </ValueSetSpec>
      <QuantitySpec id="range" name="레이더 탐지거리" cdm="Radar.Status.Range">
        <Unit>m</Unit>
      </QuantitySpec>
      <ValueSetSpec id="messageTransmitStatus" name="레이더 메시지 출력 상태" cdm="Radar.Status.MessageTransmit">
        <Values>
          <Value name="Stop" cdm="MessageOutput.Stop"/>
          <Value name="Output" cdm="MessageOutput.Output"/>
        </Values>
      </ValueSetSpec>
      <!--radarMessageTransmitStatus의 '레이더 메시지'가 RadarContactReportType 등 DDS 정보 메시지 출력을 의미하는지 CSCI에서 명시되지 않으며 대응 별도 Control도 확인되지 않는다.-->
    </GroupSpec>
        <GroupSpec id="radarVideoStatus" name="항해레이더 영상 송출 상태" cdm="Radar.Video.Status">
      <ValueSetSpec id="broadcastStatus" name="영상 송출 상태" cdm="Radar.Video.BroadcastStatus">
        <Values>
          <Value name="Stop" cdm="Streaming.Stop"/>
          <Value name="Transmit" cdm="Streaming.Transmit"/>
        </Values>
      </ValueSetSpec>
      <QuantitySpec id="frameWidth" name="프레임 너비" cdm="Radar.Video.Frame.Width"/>
      <QuantitySpec id="frameHeight" name="프레임 높이" cdm="Radar.Video.Frame.Height"/>
    </GroupSpec>
        <GroupSpec id="aisStatus" name="AIS 상태" cdm="AIS.Status">
      <ValueSetSpec id="messageTransmitStatus" name="AIS 메시지 출력 상태" cdm="AIS.Status.MessageTransmit">
        <Values>
          <Value name="Standby" cdm="MessageOutput.Standby"/>
          <Value name="Transmit" cdm="MessageOutput.Transmit"/>
        </Values>
      </ValueSetSpec>
      <QuantitySpec id="range" name="AIS 탐지거리" cdm="AIS.Status.Range">
        <Unit>m</Unit>
      </QuantitySpec>
    </GroupSpec>
        <GroupSpec id="cipeCbitStatus" name="항해레이더 처리카드 CBIT 상태" cdm="Health.CBIT.CIPE">
      <ValueSetSpec id="cipeOperationalStatus" name="자율항해장비 연동 상태" cdm="Health.CIPE.EquipmentLink">
        <Values>
          <Value name="RadarConnected" cdm="Health.CIPE.Radar.Connected"/>
          <Value name="RadarDisconnected" cdm="Health.CIPE.Radar.Disconnected"/>
          <Value name="LidarConnected" cdm="Health.CIPE.Lidar.Connected"/>
          <Value name="LidarDisconnected" cdm="Health.CIPE.Lidar.Disconnected"/>
          <Value name="NearContactConnected" cdm="Health.CIPE.NearContact.Connected"/>
          <Value name="NearContactDisconnected" cdm="Health.CIPE.NearContact.Disconnected"/>
          <Value name="EOIRConnected" cdm="Health.CIPE.EOIR.Connected"/>
          <Value name="EOIRDisconnected" cdm="Health.CIPE.EOIR.Disconnected"/>
        </Values>
      </ValueSetSpec>
      <ValueSetSpec id="operationalStatus" name="처리카드 정상 작동 여부" cdm="Health.CIPE.OperationalStatus">
        <Values>
          <Value name="Normal" cdm="Health.Normal"/>
          <Value name="Degraded" cdm="Health.Degraded"/>
          <Value name="Unavailable" cdm="Health.Unavailable"/>
          <Value name="NoResponse" cdm="Health.NoResponse"/>
        </Values>
      </ValueSetSpec>
    </GroupSpec>
  </MonitorSpecs>
  <ControlSpecs id="control">
        <ControlSpec id="startIntegration" name="연동 개시 명령" cdm="Control.Integration.Start">
          <Target cdm="Platform.Identifier.Numeric"/>
      <Reply bindRef="startIntegrationAck" cdm="Command.ProcessingStatus.Response" required="true">
        <Results>
          <Result name="commandStatusReport.status" cdm="Control.Response.Status"/>
        </Results>
      </Reply>
    </ControlSpec>
        <ControlSpec id="restartSystem" name="시스템 재시작 명령" cdm="Control.System.Restart">
          <Target cdm="Platform.Identifier.Numeric"/>